{
  "runId": "run-20260927-0300",
  "startedAt": "2026-09-27T03:00:00+09:00",
  "finishedAt": null,
  "status": "running",
  "stages": [
    {
      "name": "fetch",
      "status": "passed",
      "gate": {
        "passed": true,
        "message": "결측률 0.4%"
      },
      "ms": 81000,
      "artifacts": [
        {
          "path": "data/processed/region_daily.parquet",
          "sha256": "0000000000000000000000000000000000000000000000000000000000000000"
        }
      ]
    },
    {
      "name": "labels",
      "status": "running",
      "gate": {
        "passed": null,
        "message": ""
      },
      "ms": null,
      "artifacts": []
    }
  ],
  "summary": null
}
